{
  "$schema": "https://json-schema.org/draft/2020-12/schema",
  "$id": "https://rds-db2-provision-skill/schemas/account-defaults.schema.json",
  "title": "Account Defaults",
  "description": "Account/environment-level defaults a customer fills ONCE (from AWS console view access) and reuses for every RDS for Db2 deployment in that account. The skill merges these into each deployment intent; any value named in the prompt overrides the matching default. Every field is OPTIONAL in this file, but region, kms_key_id, master_user_secret_kms_key_id, db_subnet_group_name, monitoring_role_arn, and the IBM identifiers are REQUIRED in a deployable intent: a per-deployment intent reuses existing resources, so these must already exist. If they do not exist yet, the gitops/CI account bootstraps them ONCE by applying the 1-networking / 3-kms / 2-iam modules, then records the resulting names/ARNs here. Field names match the deployment-intent field names exactly so the merge is a straight copy. No secrets belong in this file (no master password, no AWS keys).",
  "type": "object",
  "additionalProperties": false,
  "properties": {
    "schema_version": { "description": "Version of this account-defaults file format.", "type": "string" },
    "_about": { "description": "Free-text note for humans; ignored by the skill.", "type": "string" },
    "region": { "description": "Default AWS region for deployments in this account (e.g. us-east-1).", "type": "string", "minLength": 1 },
    "vpc_id": { "description": "VPC the DB lives in (VPC console). Always customer-owned — the skill never creates a VPC. Required by the 5-rds and 1-networking modules.", "type": "string", "minLength": 1 },
    "db_subnet_group_name": { "description": "Existing DB subnet group to reuse (RDS console -> Subnet groups). If none exists, the gitops account creates one ONCE via the 1-networking module, then records its name here.", "type": "string", "minLength": 1 },
    "vpc_security_group_ids": { "description": "Existing security group id(s) to reuse (VPC console -> Security groups). The skill opens only TCP 50443 from your ingress sources on these. If none exists, the gitops account creates one ONCE via 1-networking, then records its id here.", "type": "array", "items": { "type": "string", "minLength": 1 }, "minItems": 1 },
    "kms_key_id": { "description": "Customer-managed MULTI-REGION KMS key (MRK) ARN for storage encryption (key id starts with 'mrk-'). Reused across deployments. If none exists, the gitops account creates one ONCE via the 3-kms module, then records its ARN here.", "type": "string", "minLength": 1 },
    "master_user_secret_kms_key_id": { "description": "MRK CMK ARN encrypting the RDS-managed master-user secret. Reused; create ONCE via 3-kms if absent. Needed with managed master credentials.", "type": "string", "minLength": 1 },
    "monitoring_role_arn": { "description": "Existing IAM role ARN for RDS Enhanced Monitoring to reuse. If none exists, the gitops account creates one ONCE via the 2-iam module, then records its ARN here.", "type": "string", "minLength": 1 },
    "ingress_cidrs": { "description": "Source CIDR range(s) allowed to reach Db2 SSL port 50443 (e.g. 10.0.0.0/16). 0.0.0.0/0 is rejected unless acknowledged.", "type": "array", "items": { "type": "string", "minLength": 1 }, "minItems": 1 },
    "ibm_customer_id": { "description": "IBM Passport Advantage customer id (from IBM, not AWS). Low-sensitivity; masked by the skill. Provide this OR ibm_customer_id_ssm. Required for every edition.", "type": "string", "minLength": 1 },
    "ibm_site_id": { "description": "IBM Passport Advantage site id (from IBM, not AWS). Low-sensitivity; masked by the skill. Provide this OR ibm_site_id_ssm. Required for every edition.", "type": "string", "minLength": 1 },
    "ibm_customer_id_ssm": { "description": "Name of an SSM Parameter Store SecureString holding the IBM customer id, e.g. /rds-db2/ibm-customer-id. Use this INSTEAD of ibm_customer_id to keep the value out of the repo; the parameter-group module reads it (decrypted) at apply. The deploy role needs ssm:GetParameter + kms:Decrypt.", "type": "string", "minLength": 1 },
    "ibm_site_id_ssm": { "description": "Name of an SSM Parameter Store SecureString holding the IBM site id, e.g. /rds-db2/ibm-site-id. Use this INSTEAD of ibm_site_id to keep the value out of the repo.", "type": "string", "minLength": 1 },
    "tags": { "description": "Default customer tags for every resource. Provide at least Project and Owner; Environment is set from the tier.", "type": "object", "properties": { "Project": { "type": "string", "minLength": 1 }, "Owner": { "type": "string", "minLength": 1 } } },
    "gitops_aws_account_id": { "description": "Informational only: the account whose CI role runs terraform apply (and the one-time bootstrap). Used for an identity sanity check; never written into the intent or tfvars.", "type": "string", "minLength": 1 }
  }
}
